{
    "contract_version": "1.0",
    "engine": "local_mooc_audit 0.2.0",
    "policy_version": "2027-decisoes-2026-10-28",
    "policy_warnings": [],
    "reoffer_year": 2027,
    "executed_at": "2026-10-29T10:27:59+00:00",
    "course": {
        "id": 7,
        "shortname": "AcessibilideTecnologias_2026",
        "fullname": "Acessibilidade e Tecnologia"
    },
    "viewer_userid": 0,
    "timing": {
        "snapshot_s": 0.073,
        "total_s": 0.093
    },
    "inventory": {
        "startdate": "2026-01-01 03:00",
        "enddate": "2027-01-01 02:59",
        "category": {
            "id": 1,
            "name": "Categoria 1"
        },
        "visible": 1,
        "sections": 8,
        "modules": 66,
        "modules_by_type": {
            "book": 1,
            "feedback": 3,
            "forum": 4,
            "label": 4,
            "page": 27,
            "quiz": 4,
            "resource": 21,
            "simplecertificate": 2
        },
        "grade_items": 5,
        "enrols": [
            "manual",
            "guest(off)",
            "self(off)"
        ],
        "blocks": [
            "completion_progress",
            "html",
            "html"
        ],
        "plugins_used": {
            "mod": [
                "page",
                "feedback",
                "forum",
                "label",
                "resource",
                "quiz",
                "book",
                "simplecertificate"
            ],
            "block": [
                "completion_progress",
                "html"
            ],
            "availability": [
                "completion",
                "grade",
                "days"
            ]
        },
        "files": 38,
        "files_missing_in_storage": 0,
        "site": {
            "wwwroot": "http://localhost:8092",
            "release": "4.5.15 (Build: 20261005)",
            "version": "2024100715",
            "timezone": "Europe/London",
            "enableavailability": 1,
            "enablecompletion": 1
        }
    },
    "summary": {
        "por_status": {
            "CONFORME": 48,
            "NAO_CONFORME": 16,
            "ATENCAO": 6
        },
        "nao_conformes_por_gravidade": {
            "Baixa": 1,
            "Alta": 7,
            "Média": 8
        },
        "regras": 29,
        "overall_status": "REQUER_CORRECOES"
    },
    "results": [
        {
            "local": "Sumário do curso",
            "evidencia": "link https://mooc.cefor.ifes.edu.br/moodle/login/signup.php presente",
            "encontrado": null,
            "esperado": null,
            "orientacao": "Acrescentar o botão ao final do sumário (Editar configurações do curso > Descrição).",
            "gravidade": "Média",
            "cmid": null,
            "locus": "course_settings",
            "section": null,
            "status": "CONFORME",
            "rule": "CL-04",
            "titulo": "Sumário contém botões institucionais",
            "origem": "checklist:4",
            "classe": "A",
            "category": "institutional_resources",
            "tipo": "institucional",
            "link": "http://localhost:8092/course/edit.php?id=7"
        },
        {
            "local": "Sumário do curso",
            "evidencia": "link https://mooc.cefor.ifes.edu.br/moodle/course/index.php?categoryid=7 presente",
            "encontrado": null,
            "esperado": null,
            "orientacao": "Acrescentar o botão ao final do sumário (Editar configurações do curso > Descrição).",
            "gravidade": "Média",
            "cmid": null,
            "locus": "course_settings",
            "section": null,
            "status": "CONFORME",
            "rule": "CL-04",
            "titulo": "Sumário contém botões institucionais",
            "origem": "checklist:4",
            "classe": "A",
            "category": "institutional_resources",
            "tipo": "institucional",
            "link": "http://localhost:8092/course/edit.php?id=7"
        },
        {
            "local": "Configurações do curso > Categoria",
            "evidencia": "categoria=\"Categoria 1\"",
            "encontrado": null,
            "esperado": "Inscrições Abertas",
            "orientacao": "Mover o curso para a categoria da oferta.",
            "gravidade": "Baixa",
            "cmid": null,
            "locus": "course_settings",
            "section": null,
            "status": "NAO_CONFORME",
            "rule": "CL-05",
            "titulo": "Categoria do curso = categoria de inscrições abertas",
            "origem": "checklist:5",
            "classe": "A",
            "category": "offer_enrol",
            "tipo": "institucional",
            "link": "http://localhost:8092/course/edit.php?id=7"
        },
        {
            "local": "Configurações do curso > Data de início",
            "evidencia": "início=01/01/2026 03:00 fim=01/01/2027 02:59",
            "encontrado": "ano=2026 ≠ 2027",
            "esperado": "01/01/2027",
            "orientacao": "Ajustar a data de início da oferta.",
            "gravidade": "Alta",
            "cmid": null,
            "locus": "course_settings",
            "section": null,
            "status": "NAO_CONFORME",
            "rule": "CL-06",
            "titulo": "Data de início correta (01/01 do ano da reoferta)",
            "origem": "checklist:6",
            "classe": "A",
            "category": "offer_enrol",
            "tipo": "institucional",
            "link": "http://localhost:8092/course/edit.php?id=7"
        },
        {
            "local": "Configurações do curso > Data de término",
            "evidencia": "término=01/01/2027 02:59",
            "encontrado": null,
            "esperado": "31/12/2027",
            "orientacao": "Ajustar a data de término conforme o calendário do Cefor.",
            "gravidade": "Alta",
            "cmid": null,
            "locus": "course_settings",
            "section": null,
            "status": "NAO_CONFORME",
            "rule": "CL-07",
            "titulo": "Data de término correta (31/12 do ano da reoferta)",
            "origem": "checklist:7",
            "classe": "A",
            "category": "offer_enrol",
            "tipo": "institucional",
            "link": "http://localhost:8092/course/edit.php?id=7"
        },
        {
            "local": "Métodos de inscrição > Autoinscrição (id 18)",
            "evidencia": "status=1 novas_inscricoes=1 início=(não definida) fim=(não definida)",
            "encontrado": "método desabilitado; datas de inscrição não definidas",
            "esperado": null,
            "orientacao": "Editar a Autoinscrição: habilitar, permitir novas inscrições e alinhar as datas com as do curso.",
            "gravidade": "Alta",
            "cmid": null,
            "locus": "enrol",
            "section": null,
            "status": "NAO_CONFORME",
            "rule": "CL-08",
            "titulo": "Autoinscrição habilitada com período correto",
            "origem": "checklist:8",
            "classe": "A",
            "category": "offer_enrol",
            "tipo": "institucional",
            "link": "http://localhost:8092/enrol/instances.php?id=7"
        },
        {
            "local": "forum \"Espaço de interação\" (cmid=131)",
            "evidencia": "presente",
            "encontrado": null,
            "esperado": null,
            "orientacao": null,
            "gravidade": "Média",
            "cmid": 131,
            "locus": "module_edit",
            "section": null,
            "status": "CONFORME",
            "rule": "CL-09",
            "titulo": "Fórum institucional \"Espaço de interação\" presente e sem conclusão",
            "origem": "checklist:9",
            "classe": "A",
            "category": "institutional_resources",
            "tipo": "institucional",
            "link": "http://localhost:8092/course/modedit.php?update=131"
        },
        {
            "local": "feedback \"Pesquisa de Perfil \" (cmid=130)",
            "evidencia": "presente",
            "encontrado": null,
            "esperado": null,
            "orientacao": null,
            "gravidade": "Alta",
            "cmid": 130,
            "locus": "module_edit",
            "section": null,
            "status": "CONFORME",
            "rule": "CL-11",
            "titulo": "Pesquisa de Perfil presente e exigida pelo certificado",
            "origem": "checklist:11",
            "classe": "A",
            "category": "institutional_resources",
            "tipo": "institucional",
            "link": "http://localhost:8092/course/modedit.php?update=130"
        },
        {
            "local": "simplecertificate \"Certificado digital de conclusão\" (cmid=187)",
            "evidencia": "restrições de conclusão: cmids [186,130]",
            "encontrado": null,
            "esperado": "exigir conclusão de cm=130 (Pesquisa de Perfil)",
            "orientacao": "Adicionar ao certificado a restrição de conclusão da Pesquisa de Perfil.",
            "gravidade": "Alta",
            "cmid": 187,
            "locus": "module_edit",
            "section": null,
            "status": "CONFORME",
            "rule": "CL-11",
            "titulo": "Pesquisa de Perfil presente e exigida pelo certificado",
            "origem": "checklist:11",
            "classe": "A",
            "category": "institutional_resources",
            "tipo": "institucional",
            "link": "http://localhost:8092/course/modedit.php?update=187"
        },
        {
            "local": "Livro de notas > Configurações",
            "evidencia": "soma dos máximos=100 itens=quiz:145=4, quiz:158=4, quiz:162=2, quiz:185=90",
            "encontrado": null,
            "esperado": "100",
            "orientacao": "Ajustar as notas máximas das atividades.",
            "gravidade": "Alta",
            "cmid": null,
            "locus": "gradebook",
            "section": null,